{
  "adopted_commit_id": "cmt_00000006-0000-4000-8000-000000000006",
  "adopted_sequence": 6,
  "approved_by": {
    "actor_id": "prn_00000001-0000-4000-8000-000000000001",
    "actor_type": "owner"
  },
  "created_at": "2026-09-28T09:30:00.000Z",
  "evidence": "publish_journal",
  "manifest_sha256": "46fc428a7a9168b796bafa3053429ba7b836a496a021dc4aa4eb8189531b1952",
  "previous_current_sha256": "21a8c806966493722a678cf602c6f87a4861e99776c6cd3f8d4e2769ad64dca3",
  "recovery_id": "op_0000005a-0000-4000-8000-00000000005a",
  "schema_version": 1,
  "trusted_surface": "trusted_local_cli",
  "vault_id": "vlt_00000001-0000-4000-8000-000000000001"
}
